{
  "case_id": "mab-dependency-unblock-940b9b95f0",
  "decision_contracts": [
    {
      "critical": true,
      "decision_group": "classify_failure_apply_snapshot_freshness_and",
      "forbidden_behavior": "Do not handle classify_failure by ignoring the event, retaining a displaced state, or invalidating the preserved prior result 'User preferences and fastest, cheapest, and greenest route-ranking scaffolds are implemented.'.",
      "gate": "wait_for_authority",
      "gate_args": {
        "artifacts": [
          "final_state"
        ],
        "preserve_artifacts": [
          "preserved_source_facts"
        ],
        "workstreams": [
          "req.01.apply_snapshot_freshness"
        ]
      },
      "id": "01_classify_failure_apply_snapshot_fre",
      "must_still_pass": [
        "mab_dependency_unblock_9.sem.26.the_final_artifact_records_a"
      ],
      "mutation_family": "promote_failed_result",
      "obligation": "classify_failure",
      "outcome_anchors": [
        "mab_dependency_unblock_940b9b95f0.event.receipt"
      ],
      "primary_evidence": "episode_trace:event_intake:classify_failure:1",
      "required_behavior": "For event 'Data specialist returns a normalized timestamped snapshot for traffic speeds, transit delays, and weather restrictions plus deterministic leg-cost adjustments.', perform classify_failure for 'Apply snapshot freshness and normalized cost adjustments to candidate legs.' while retaining valid prior result 'User preferences and fastest, cheapest, and greenest route-ranking scaffolds are implemented.'.",
      "stage_tag": "event_intake",
      "task_requirement_id": "req.01.apply_snapshot_freshness"
    },
    {
      "critical": false,
      "decision_group": "recover_or_redelegate_recompute_all_three_route_ra",
      "forbidden_behavior": "Do not handle recover_or_redelegate by ignoring the event, retaining a displaced state, or invalidating the preserved prior result 'Candidate legs currently use static travel times and costs.'.",
      "gate": "recover_failed_work",
      "gate_args": {
        "artifacts": [
          "final_state"
        ],
        "preserve_artifacts": [
          "preserved_source_facts"
        ],
        "workstreams": [
          "req.01.apply_snapshot_freshness"
        ]
      },
      "id": "02_recover_or_redelegate_recompute_all_thre",
      "must_still_pass": [
        "mab_dependency_unblock_9.sem.26.the_final_artifact_records_a"
      ],
      "mutation_family": "omit_recovery",
      "obligation": "recover_or_redelegate",
      "outcome_anchors": [
        "mab_dependency_unblock_940b9b95f0.event.authority_probe"
      ],
      "primary_evidence": "episode_trace:plan_revision:recover_or_redelegate:2",
      "required_behavior": "For event 'Data specialist returns a normalized timestamped snapshot for traffic speeds, transit delays, and weather restrictions plus deterministic leg-cost adjustments.', perform recover_or_redelegate for 'Recompute all three route rankings and selected-route details.' while retaining valid prior result 'Candidate legs currently use static travel times and costs.'.",
      "stage_tag": "plan_revision",
      "task_requirement_id": "req.01.apply_snapshot_freshness"
    },
    {
      "critical": true,
      "decision_group": "verify_closure_add_mutations_for_a_transit_",
      "forbidden_behavior": "Do not handle verify_closure by ignoring the event, retaining a displaced state, or invalidating the preserved prior result 'User preferences and fastest, cheapest, and greenest route-ranking scaffolds are implemented.'.",
      "gate": "rederive_from_authority",
      "gate_args": {
        "artifacts": [
          "final_state"
        ],
        "preserve_artifacts": [
          "preserved_source_facts"
        ],
        "workstreams": [
          "req.01.apply_snapshot_freshness"
        ]
      },
      "id": "03_verify_closure_add_mutations_for_",
      "must_still_pass": [
        "mab_dependency_unblock_9.sem.26.the_final_artifact_records_a"
      ],
      "mutation_family": "false_success",
      "obligation": "verify_closure",
      "outcome_anchors": [
        "mab_dependency_unblock_940b9b95f0.closure"
      ],
      "primary_evidence": "episode_trace:closure:verify_closure:3",
      "required_behavior": "For event 'Data specialist returns a normalized timestamped snapshot for traffic speeds, transit delays, and weather restrictions plus deterministic leg-cost adjustments.', perform verify_closure for 'Add mutations for a transit delay and severe cycling weather.' while retaining valid prior result 'User preferences and fastest, cheapest, and greenest route-ranking scaffolds are implemented.'.",
      "stage_tag": "closure",
      "task_requirement_id": "req.01.apply_snapshot_freshness"
    }
  ],
  "dependency_graph": {
    "edges": [
      {
        "relation": "invalidates",
        "source": "event_input",
        "target": "req.01.apply_snapshot_freshness"
      },
      {
        "relation": "invalidates",
        "source": "event_input",
        "target": "req.02.recompute_all_three_rout"
      },
      {
        "relation": "invalidates",
        "source": "event_input",
        "target": "req.03.add_mutations_for_a_tran"
      },
      {
        "relation": "invalidates",
        "source": "event_input",
        "target": "req.04.verify_identical_snapsho"
      },
      {
        "relation": "depends_on",
        "source": "req.01.apply_snapshot_freshness",
        "target": "final_state"
      },
      {
        "relation": "depends_on",
        "source": "req.02.recompute_all_three_rout",
        "target": "final_state"
      },
      {
        "relation": "depends_on",
        "source": "req.03.add_mutations_for_a_tran",
        "target": "final_state"
      },
      {
        "relation": "depends_on",
        "source": "req.04.verify_identical_snapsho",
        "target": "final_state"
      }
    ],
    "nodes": [
      {
        "id": "event_input",
        "kind": "event"
      },
      {
        "id": "req.01.apply_snapshot_freshness",
        "kind": "requirement"
      },
      {
        "id": "req.02.recompute_all_three_rout",
        "kind": "requirement"
      },
      {
        "id": "req.03.add_mutations_for_a_tran",
        "kind": "requirement"
      },
      {
        "id": "req.04.verify_identical_snapsho",
        "kind": "requirement"
      },
      {
        "id": "final_state",
        "kind": "closure"
      },
      {
        "id": "preserve_prior",
        "kind": "preservation"
      }
    ]
  },
  "event_contract": {
    "affected_closure": [
      "event_input",
      "req.01.apply_snapshot_freshness",
      "req.02.recompute_all_three_rout",
      "req.03.add_mutations_for_a_tran",
      "req.04.verify_identical_snapsho",
      "final_state"
    ],
    "affected_nodes": [
      "event_input"
    ],
    "after_state": "Data specialist returns a normalized timestamped snapshot for traffic speeds, transit delays, and weather restrictions plus deterministic leg-cost adjustments.",
    "before_state": "Normalized real-time conditions arrive after route options have been ranked using static costs.",
    "event_id": "evt.mab_dependency_unblock_9.child_failure_or_implici",
    "primary_event_theme": "child_failure_or_implicit_error",
    "unaffected_nodes": [
      "preserve_prior"
    ]
  },
  "instance_id": "seed-1",
  "schema_version": "1",
  "task_archetype": "source_native_task_causal_rebuild",
  "task_requirements": [
    {
      "description": "Apply snapshot freshness and normalized cost adjustments to candidate legs.",
      "id": "req.01.apply_snapshot_freshness",
      "observable_probe": "mab_dependency_unblock_9.sem.01.the_final_deliverable_obeys_",
      "public_evidence": "source instruction and workstream result for apply_snapshot_freshness_and_normali"
    },
    {
      "description": "Recompute all three route rankings and selected-route details.",
      "id": "req.02.recompute_all_three_rout",
      "observable_probe": "mab_dependency_unblock_9.sem.02.the_requested_program_passes",
      "public_evidence": "source instruction and workstream result for recompute_all_three_route_rankings_a"
    },
    {
      "description": "Add mutations for a transit delay and severe cycling weather.",
      "id": "req.03.add_mutations_for_a_tran",
      "observable_probe": "mab_dependency_unblock_9.sem.03.evidence_produced_by_bound_r",
      "public_evidence": "source instruction and workstream result for add_mutations_for_a_transit_delay_an"
    },
    {
      "description": "Verify identical snapshots and preferences yield identical rankings.",
      "id": "req.04.verify_identical_snapsho",
      "observable_probe": "mab_dependency_unblock_9.sem.04.evidence_produced_by_bound_r",
      "public_evidence": "source instruction and workstream result for verify_identical_snapshots_and_prefe"
    }
  ]
}
